{
  "id": "ascend_vllm_ascend_6ebe6ef9",
  "platform": "ascend",
  "name": "vllm-ascend on Huawei Ascend NPU",
  "framework": "vllm-ascend",
  "submitted_by": "JuhaoLiang1997",
  "description": "AccelMark runner for Huawei Ascend 910B/910C NPUs using vllm-ascend (vLLM community fork for CANN). Supports Suite A–E. NPU memory queried via torch_npu. FP8 excluded: not supported on current Ascend 910B/910C hardware.",
  "supersedes_chain": [],
  "notes": "Decouple runners from suite and scenario knowledge — load_model() uses use_async from parallelism dict instead of checking scenario name.",
  "created": "2026-04-03"
}
